City,Clinic,Location,Fee,Experience,Phone,Timestamp
rajkot,Dr. Nishant Dharsandia,"Hem Onc Care Center, Rajkot Manahar Plot, Rajkot",800,12 years,N/A,2025-05-29 05:06:56
rajkot,Dr. Divyang Bhimani,"Divine Child Care Clinic, Mavdi, Rajkot",300,16 years,N/A,2025-05-29 05:06:56
rajkot,Dr. Atul Rathod,"Dr Atul Rathod Clinic, Rajkot Manahar Plot, Rajkot",600,48 years,N/A,2025-05-29 05:06:56
rajkot,Dr. Bhatt Vivek Prafulchandra,"Anish Hospital, Rajkot Race Course Road, Rajkot",400,6 years,N/A,2025-05-29 05:06:56
rajkot,Dr. Tejas Trivedi,"Trivedi Hospital, Nana Mava, Rajkot",300,29 years,N/A,2025-05-29 05:07:31
rajkot,Dr. N. N. Sankharava,"Child Care Centre, Rajkot New Jagnath Plot, Rajkot",400,25 years,N/A,2025-05-29 05:07:31
rajkot,Dr. Jaydeep Kansagra,"Spandan Children Hospital, Mota Mava, Rajkot",200,11 years,N/A,2025-05-29 05:07:31
rajkot,Dr. Hiren Mashru,"Nihit Babycare Children Hospital, Rajkot Bhaktinagar, Rajkot",200,13 years,N/A,2025-05-29 05:07:31
rajkot,Dr. MITUL UNADKAT,"Sanidhya Neonatal and Child Unit, Rajkot Municipal Corporation, Rajkot",400,13 years,N/A,2025-05-29 05:07:32
rajkot,Dr. Bhargav Sorathia,"Killol Children Hospital, Sadhu Vaswani Road, Rajkot",400,27 years,N/A,2025-05-29 05:07:32
rajkot,Dr. Tarun Gondalia,"Child And Neurology Epilepsy center, Rajkot New Jagnath Plot, Rajkot",1000,19 years,N/A,2025-05-29 05:07:32
ranchi,Dr. Sunita Katyayan,"Dr. S. Katyayan Clinic, Ratu, Ranchi",600,47 years,N/A,2025-05-29 05:09:12
ranchi,Dr. Anitabh Kumar,"New Born  Child Care Centre, Harmu Housing Colony, Ranchi",300,24 years,N/A,2025-05-29 05:09:12
ranchi,Dr. Kailash Prasad,"Siddharth Medicals, Kanke Road, Ranchi",200,38 years,N/A,2025-05-29 05:09:12
ranchi,Dr. Amit Mohan,"Dr. Amit Mohan Clinic, DDM, OIC Ltd, Kadru, Ranchi",400,25 years,N/A,2025-05-29 05:09:12
ranchi,Dr. Subash Poddar,"Poddar Vaccination Centre, Ratu, Ranchi",300,23 years,N/A,2025-05-29 05:09:12
ranchi,Dr. Rakesh Kumar,"New Born And Child Clinic, Kadru, Ranchi",300,26 years,N/A,2025-05-29 05:09:13
ranchi,Dr. Bhavya Kumar Jain,"Jinwani Hospital, Lalpur, Ranchi",400,15 years,N/A,2025-05-29 05:09:13
ranchi,Dr. Chandan Barnwal,"Baba Baidyanath Medical, Kokar, Ranchi",500,7 years,N/A,2025-05-29 05:09:13
ranchi,Dr. Rakesh Kumar,"Vatsalya Children and Dental Hospital, Hinoo, Ranchi",400,18 years,N/A,2025-05-29 05:09:13
ranchi,Dr. Kumar Abhishek,"Shri Balram Children Hospital, Harmu Housing Colony, Ranchi",400,9 years,N/A,2025-05-29 05:09:13
ranchi,Dr. S S Sidana,"Dr S S Sidana Clinic, Ranchi, Ranchi",500,34 years,N/A,2025-05-29 05:09:50
ranchi,Dr. Praveen Narsaria,"Sree Shyam Medical Hall, Upper Bazar, Ranchi",300,15 years,N/A,2025-05-29 05:09:51
thiruvananthapuram,Dr. Sukanya V,"Dr. Sukanya V Pediatric Clinic, Kannammoola, Thiruvananthapuram",600,7 years,N/A,2025-05-29 05:16:40
thiruvananthapuram,Dr. Prema J Kumar,"Vijaya Non Surgical Spine Institute, Vanchiyur, Thiruvananthapuram",400,39 years,N/A,2025-05-29 05:16:40
thiruvananthapuram,Dr. Lalitha Kailas,"Dr. Lalitha Kailas Pediatrics Clinic, Kaudiar, Thiruvananthapuram",150,49 years,N/A,2025-05-29 05:16:40
thiruvananthapuram,Dr. Sastha L P,"Ponnambalam Child Care, Neyyattinkara, Thiruvananthapuram",400,38 years,N/A,2025-05-29 05:16:40
thiruvananthapuram,Dr. Jose Mammen,"Dr. Jose Mammen, Pattom Palace, Thiruvananthapuram",300,51 years,N/A,2025-05-29 05:16:40
thiruvananthapuram,Dr. Sarah T Kuruvila,"Sasikala Polyclinic, Palayam, Thiruvananthapuram",100,51 years,N/A,2025-05-29 05:16:41
thiruvananthapuram,Dr. Sanitha Anilkumar,"Aarjav Pediatric Clinic, TV University, Thiruvananthapuram",200,28 years,N/A,2025-05-29 05:16:41
thiruvananthapuram,Dr. Elizabeth Mathew,"Dr Elizabeth Mathew Clinic, Panangode, Thiruvananthapuram",100,50 years,N/A,2025-05-29 05:16:41
thiruvananthapuram,Dr. Shahanaz Ahamed M,"Dr. Shahanaz Pediatrician Neurology Clinic, Pattom, Thiruvananthapuram",500,20 years,N/A,2025-05-29 05:16:41
thiruvananthapuram,Dr. Roy Sankar,"Dr Roy Sankar, Nalanchira, Thiruvananthapuram",300,39 years,N/A,2025-05-29 05:16:41
thiruvananthapuram,Dr. Mohammed Farook,"Dr farooks childrens hospital, Ambalathara, Thiruvananthapuram",250,36 years,N/A,2025-05-29 05:17:15
thiruvananthapuram,Dr. Praveen KS,"Pediatric Clinic, Pattom, Thiruvananthapuram",300,18 years,N/A,2025-05-29 05:17:15
thiruvananthapuram,Dr. Reeba Ann Daniel,"Dr. Reeba Ann Daniel, Kudappanakunnu, Thiruvananthapuram",200,12 years,N/A,2025-05-29 05:17:15
thiruvananthapuram,Dr. Divya Varghese,"Credence Hospital, Ulloor, Thiruvananthapuram",300,15 years,N/A,2025-05-29 05:17:16
thiruvananthapuram,Dr. Aravind S,"NIMS Hospital, Balaramapuram, Thiruvananthapuram",200,9 years,N/A,2025-05-29 05:17:16
vadodara,Dr. Vinit M Mehta,"Aashrey Child Clinic, New Sama Road, Vadodara",500,9 years,N/A,2025-05-29 05:18:48
vadodara,Dr. Ashvin Shah,"Dr. Ashvin Shah Clinic, Manjalpur, Vadodara",400,44 years,N/A,2025-05-29 05:18:48
vadodara,Dr. Sarbani Raha,"Child Neurology  Epilepsy Clinic, Makarpura, Vadodara",1500,20 years,N/A,2025-05-29 05:18:48
vadodara,Dr. Jigar Shah,"Aashray Children Hospital, Waghodia Road, Vadodara",200,13 years,N/A,2025-05-29 05:18:48
vadodara,Dr. Hitesh Desai,"Urmil Children Hospital, Sama, Vadodara",400,38 years,N/A,2025-05-29 05:18:48
vadodara,Dr. Palak P Shah,"Amrut Child Care, Ajwa Road, Vadodara",500,16 years,N/A,2025-05-29 05:18:48
vadodara,Dr. Vandan H Kumar,"Ved Childrens Clinic, Makarpura, Vadodara",300,12 years,N/A,2025-05-29 05:18:48
vadodara,Dr. Samir R Shah,"Samir Hospital, Dandia Bazar, Vadodara",400,26 years,N/A,2025-05-29 05:18:49
vadodara,Dr. Rahul Thanawala,"Akshar Hospital, Akota, Vadodara",400,32 years,N/A,2025-05-29 05:18:49
vadodara,Dr. Ritesh V. Shah,"Vraj Children Hospital, Waghodia Road, Vadodara",300,24 years,N/A,2025-05-29 05:18:49
vadodara,Dr. Lalit Nainiwal,"Pragya Child Clinic, Gotri, Vadodara",200,18 years,N/A,2025-05-29 05:19:25
vadodara,Dr. Bhavin Soni,"Vatsalya Children Hospital, Tarsali, Vadodara",250,27 years,N/A,2025-05-29 05:19:25
vadodara,Dr. Chetan M Chawda,"Heet Child Care, Akota, Vadodara",300,19 years,N/A,2025-05-29 05:19:25
vadodara,Dr. Manali Vilyesh Patel,"Sharada Hospital, Chhota-udepur, Vadodara",500,11 years,N/A,2025-05-29 05:19:25
vadodara,Dr. Vijaya Shree Mishra,"Divyam Womens Hospital, Ellora Park, Vadodara",300,12 years,N/A,2025-05-29 05:19:25
vadodara,Dr. Uma Nayak,"Luxor Hospital, Saiyed Vasna, Vadodara",1200,43 years,N/A,2025-05-29 05:19:25
vadodara,Dr. Manish,"Kilkari child care, Sun Pharma Road, Vadodara",300,15 years,N/A,2025-05-29 05:19:25
vadodara,Dr. Nawaz Patel,"SSG Hospital, Sayajiganj, Vadodara",1,12 years,N/A,2025-05-29 05:19:25
vadodara,Dr. Bhavesh Shah,"Riddhi Children Hospital, Sama, Vadodara",800,31 years,N/A,2025-05-29 05:19:25
vadodara,Dr. Nilay Chaudhari,"RAINBOW CHILDREN HOSPITAL, Sama, Vadodara",500,12 years,N/A,2025-05-29 05:19:25
vadodara,Dr. Hardik Dave,"Sparsh Child Care Clinic, Manjalpur, Vadodara",N/A,12 years,N/A,2025-05-29 05:19:25
vadodara,Dr. Viral Patel,"Shree Krishna Children and Dental Hospital, Manjalpur, Vadodara",300,11 years,N/A,2025-05-29 05:19:25
vadodara,Dr. Ronaksinh Rameshchandra Solanki,"R Apple Children Hospital, Waghodia Road, Vadodara",350,13 years,N/A,2025-05-29 05:19:26
vadodara,Dr. Tomar Sadhana,"R Apple Children Hospital, Waghodia Road, Vadodara",350,12 years,N/A,2025-05-29 05:19:26
vadodara,Dr. Pradhyumn Pamecha,"Dhiraj Hospital, Waghodia, Vadodara",300,7 years,N/A,2025-05-29 05:19:26
vadodara,Dr. Anmol Patel,"Adhyamaheshwar Multi-speciality Hospital, Nizampura Road, Vadodara",500,6 years,N/A,2025-05-29 05:19:26
vadodara,Dr. Gautam Shah,"Ganga Clinic, Raopura, Vadodara",400,13 years,N/A,2025-05-29 05:19:26
varanasi,Vatsalya Children Hospital,N/A,500,38 years,N/A,2025-05-29 05:20:17
varanasi,Dr. Divyank Pathak,"Vatsalya Children Hospital, Orderly Bazaar, Varanasi",500,23 years,N/A,2025-05-29 05:20:52
varanasi,Dr. Rahul Gupta,"SPDM Clinic, Mahmoorganj, Varanasi",300,12 years,N/A,2025-05-29 05:20:52
varanasi,Dr. Kanchan Shukla,"Oriana Hospital, Lanka, Varanasi",400,11 years,N/A,2025-05-29 05:20:52
visakhapatnam,Dr. Anita Tripathy,"Medicover Woman  Child Hospitals, Jagadamba Junction, Visakhapatnam",500,35 years,N/A,2025-05-29 05:22:24
visakhapatnam,Dr. Garuda Rama,"Medicover Woman  Child Hospitals, Jagadamba Junction, Visakhapatnam",500,34 years,N/A,2025-05-29 05:22:24
visakhapatnam,Dr. Sai Sunil Kishore M,"Medicover Woman  Child Hospitals, Jagadamba Junction, Visakhapatnam",500,16 years,N/A,2025-05-29 05:22:24
visakhapatnam,Dr. K.T.V. Lakshman Kumar,"Medicover Hospitals - Visakhapatnam, Maharani Peta, Visakhapatnam",500,17 years,N/A,2025-05-29 05:22:24
visakhapatnam,Dr. Sree Harsha Yarlagadda,"Apollo Healthcity Hospital, Ram Nagar, Visakhapatnam",400,13 years,N/A,2025-05-29 05:22:24
visakhapatnam,Dr. Manasa Gundapaneni,"Medicover Hospitals - Visakhapatnam, Maharani Peta, Visakhapatnam",300,14 years,N/A,2025-05-29 05:22:24
visakhapatnam,Dr. Mounica Adari,"Veda Childrens Clinic, Gopalapatnam, Visakhapatnam",300,8 years,N/A,2025-05-29 05:22:24
visakhapatnam,Dr. Santhi Meher Peddi,"Dr Santhi Childrens Clinic, Kancharapalem, Visakhapatnam",350,14 years,N/A,2025-05-29 05:22:24
visakhapatnam,Dr. Ananth Vemana,"Aditya Childrens Clinic, Madhurawada, Visakhapatnam",500,22 years,N/A,2025-05-29 05:22:24
visakhapatnam,Dr. Shrikanth R,"Lotus Hospitals For Women And Children, Siripuram, Visakhapatnam",350,15 years,N/A,2025-05-29 05:22:24
visakhapatnam,Dr. Radha Krishna K,"Omni RK Super Speciality Hospital, Ram Nagar, Visakhapatnam",600,40 years,N/A,2025-05-29 05:23:01
visakhapatnam,Dr. Sriharsha Badana,"Tirumala Vijaya Hospital, MVP Colony, Visakhapatnam",300,14 years,N/A,2025-05-29 05:23:01
visakhapatnam,Dr. P Sateesh Kumar,"Satya Child Clinic, Maharani Peta, Visakhapatnam",300,18 years,N/A,2025-05-29 05:23:01
visakhapatnam,Dr. Rajni Mukherjee,"Seven Hills Hospitals, Waltair R S, Visakhapatnam",400,43 years,N/A,2025-05-29 05:23:01
visakhapatnam,Dr. T P Gandhi,"Narendra Poly Clinic, MVP Colony, Visakhapatnam",250,58 years,N/A,2025-05-29 05:23:01
visakhapatnam,Dr. K Seshagiri,"Omni RK Super Speciality Hospital, Ram Nagar, Visakhapatnam",300,34 years,N/A,2025-05-29 05:23:02
visakhapatnam,Dr. D V Ramabhadra Raju,"Lakshmi Vijaya Childrens Hospital, Thagarapuvalasa, Visakhapatnam",200,11 years,N/A,2025-05-29 05:23:02
visakhapatnam,Dr. B Rajsekhar,"Omni RK Super Speciality Hospital, Ram Nagar, Visakhapatnam",300,29 years,N/A,2025-05-29 05:23:02
visakhapatnam,Dr. Phani Krishna,"Krishna Childrens Hospital, Akkayyapalem, Visakhapatnam",300,11 years,N/A,2025-05-29 05:23:02
visakhapatnam,Dr. K Ravi Kiran Reddy,"Dr. K. Ravi Kiran Reddy Clinic, Akkayyapalem, Visakhapatnam",200,17 years,N/A,2025-05-29 05:23:02
visakhapatnam,Dr. G. Ganesh Babu,"G. Ganesh Babu Clinic, Seethammadhara, Visakhapatnam",200,38 years,N/A,2025-05-29 05:23:39
visakhapatnam,Dr. N.L Narasimha Rao,"Chandamama Childrens Clinic, Gajuwaka, Visakhapatnam",150,20 years,N/A,2025-05-29 05:23:39
visakhapatnam,Dr. Suchitra Pusapati,"Sri Krishna ENT Clinic  Sanhiti Childrens Clinic, H B Colony, Visakhapatnam",300,23 years,N/A,2025-05-29 05:23:39
visakhapatnam,Dr. P.Satish Chandra,"Dr. P. Satish Chandras Clinic, Maharani Peta, Visakhapatnam",200,17 years,N/A,2025-05-29 05:23:39
visakhapatnam,Dr. Kedari Nagarjuna,"GVK Prime Clinics, MVP Colony, Visakhapatnam",300,14 years,N/A,2025-05-29 05:23:39
visakhapatnam,Dr. P. Rama Krishna Raju,"Child Health Care Clinic, Marripalem, Visakhapatnam",200,36 years,N/A,2025-05-29 05:23:39
visakhapatnam,Dr. Ch. Suman,"Safe Children Clinic, Maddilapalem, Visakhapatnam",200,14 years,N/A,2025-05-29 05:23:39
visakhapatnam,Dr. Manga deepankuri korada,"Hashmika Child Clinic, Kancharapalem, Visakhapatnam",250,16 years,N/A,2025-05-29 05:23:40
visakhapatnam,Dr. V Muddukrishna,"Dr. Madhu Krishna Children Hospital, Gajuwaka, Visakhapatnam",120,42 years,N/A,2025-05-29 05:23:40
visakhapatnam,Dr. Arisetty Srikant,"Kalavathi Hospitals, Akkayyapalem, Visakhapatnam",150,25 years,N/A,2025-05-29 05:23:40
visakhapatnam,Dr. Santhosh Kumar Routhu,"Susruta ENT Clinic, Dwarakanagar, Visakhapatnam",500,8 years,N/A,2025-05-29 05:23:40
visakhapatnam,Dr. KNSSV Chalapathi Rao,"Sri Kamaraju Clinic, Maharani Peta, Visakhapatnam",400,16 years,N/A,2025-05-29 05:23:40
visakhapatnam,Dr. K kameshwari,"Doctors Plaza, Maharani Peta, Visakhapatnam",200,31 years,N/A,2025-05-29 05:23:40
visakhapatnam,Dr. Y. Sreeharsha,"Sree Health Care, Seethammadhara, Visakhapatnam",250,16 years,N/A,2025-05-29 05:23:40
visakhapatnam,Dr. R. Kishore Raju,"Visakha Child Care Centre, Gajuwaka, Visakhapatnam",150,18 years,N/A,2025-05-29 05:23:40
visakhapatnam,Dr. Kartheek Nalluri,"Omni RK Super Speciality Hospital, Ram Nagar, Visakhapatnam",500,17 years,N/A,2025-05-29 05:23:40
visakhapatnam,Dr. Valapala Venkatesh,"Dr.V.Venkatesh Child Care Clinic, Dwarakanagar, Visakhapatnam",400,10 years,N/A,2025-05-29 05:23:40
visakhapatnam,Dr. Talacheru Tirupathi,"Sunrise Childrens Hospital, Gajuwaka, Visakhapatnam",350,20 years,N/A,2025-05-29 05:23:40
visakhapatnam,Dr. Harischandra,"Ujwal Hospital, Madhurawada, Visakhapatnam",200,25 years,N/A,2025-05-29 05:23:40
visakhapatnam,Dr. Uday Dipakrao Gajare,"Asian Institute of Nephrology and Urology, Dwarakanagar, Visakhapatnam",600,15 years,N/A,2025-05-29 05:23:41
