City,Clinic,Location,Fee,Experience,Phone,Timestamp
agra,Dr. Sameer Sharma,"Param Child Care, Tajganj, Agra",250,14 years,N/A,2025-05-29 03:50:07
agra,Dr. Amit Saxena,"Dr. Saxena Multispeciality Clinic, Nehru Nagar, Agra",500,22 years,N/A,2025-05-29 03:50:07
agra,Dr. Neha Garg,"Dr Neha Gargs Clinic, Avas Vikas Colony, Agra",250,15 years,N/A,2025-05-29 03:50:07
agra,Dr. R. N. Goel,"Agra Hospital, Civil Line, Agra",150,51 years,N/A,2025-05-29 03:50:07
agra,Dr. Arun Jain,"Dr. Arun Child Hospital, Shahaganj, Agra",400,31 years,N/A,2025-05-29 03:50:07
agra,Dr. J. N. Tondon,"Dr. J. N. Tandon, Shahaganj, Agra",200,36 years,N/A,2025-05-29 03:50:07
agra,Dr. U. P. S. Mehta,"Family Clinic, Rajpur, Agra",200,45 years,N/A,2025-05-29 03:50:07
agra,Dr. K. B. Shani,"Dr. K. B. Sahnis Clinic, Agra, Agra",100,50 years,N/A,2025-05-29 03:50:07
agra,Dr. Deepak Kapoor,"Dr. Deepak Kapoor Clinic, Civil Line, Agra",300,37 years,N/A,2025-05-29 03:50:07
agra,Dr. Girish Narayan Gupta,"Vijay Nagar Hospital, Civil Line, Agra",200,50 years,N/A,2025-05-29 03:50:07
agra,Dr. Premashish Mazumdar,"Multi Speciality Clinic, Civil Line, Agra",500,18 years,N/A,2025-05-29 03:50:47
agra,Dr. Nidhi Agarwal,"Satyam Hospital, Kamla Nagar, Agra",500,29 years,N/A,2025-05-29 03:50:48
agra,Dr. Subash Mittal,"Mittal Hospital, Kheria, Agra",200,37 years,N/A,2025-05-29 03:50:48
agra,Dr. Rahul Pengoria,"Dr. Pengoria Hospital, Shaheed Nagar, Agra",200,18 years,N/A,2025-05-29 03:50:48
agra,Dr. Avadhesh Kumar Gupta,"Dr. Avadhesh Kumar Guptas Clinic, Avas Vikas Colony, Agra",150,29 years,N/A,2025-05-29 03:50:48
agra,Dr. Kshitij Sharma,"Dr R.D. Sharma Clinic, Raja Mandi, Agra",200,16 years,N/A,2025-05-29 03:50:48
agra,Dr. Mukesh Bhardwaj,"Bhardwaj Child And Dental Clinic, Arjun Nagar, Agra",200,13 years,N/A,2025-05-29 03:50:48
agra,Dr. Mukesh Baghel,"Dr Mukesh Kumar Baghel, Tajganj, Agra",300,11 years,N/A,2025-05-29 03:50:48
agra,Dr. Reshu Agarwal,"Child Care Clinic, Delhi Gate, Agra",300,13 years,N/A,2025-05-29 03:50:48
agra,Dr. Ajay Kalra,"Dr. Kalaras - Child Health Consultants, T.P. Nagar, Agra",N/A,45 years,N/A,2025-05-29 03:50:48
agra,Dr. Sonia Bhatt,"Urocare Clinic, Delhi Gate, Agra",400,23 years,N/A,2025-05-29 03:50:48
agra,Dr. L.K. Garg,"Dr L K Garg Pediatric Clinic, Khandari, Agra",300,20 years,N/A,2025-05-29 03:50:48
agra,Dr. Abhaya Yadav,"Dr. Abhay Yadav, Gokulpura, Agra",150,23 years,N/A,2025-05-29 03:50:48
agra,Dr. Unnat Kulshrestra,"Dr. Unnat Kulshrestha, Tajganj, Agra",150,35 years,N/A,2025-05-29 03:50:48
agra,Dr. Atul Bansal,"Dr. Atul Bansals Clinic - Sikandra, Sikandra, Agra",150,20 years,N/A,2025-05-29 03:50:48
agra,Dr. Harendra Mohniya,"Dr. Harendra Mohniya Clinic, Tajganj, Agra",150,40 years,N/A,2025-05-29 03:50:48
agra,Dr. Jaswant Singh Chahar,"Chahar Child Care Center, Kheria Airport, Agra",100,13 years,N/A,2025-05-29 03:50:48
agra,Dr. Malay Gupta,"Pushpam Mother  Child Health Care Centre, Sikandra, Agra",400,22 years,N/A,2025-05-29 03:50:48
agra,Dr. Vishal Gupta,"Dr. Vishal Guptas Clinic, Civil Line, Agra",300,22 years,N/A,2025-05-29 03:50:48
agra,Dr. R. S. Bhadhoria,"Bhadauria Child Care Centre, Kheria, Agra",150,20 years,N/A,2025-05-29 03:50:48
agra,Dr. Prakhar Mohniya,"Mohniya Newborn and Child Hospital, Shaheed Nagar, Agra",300,9 years,N/A,2025-05-29 03:51:26
agra,Dr. Puja Agarwal,"DR. PUJA AGARWAL CLINIC, Gurki Mandi, Agra",300,23 years,N/A,2025-05-29 03:51:26
agra,Dr. Saurabh Singh,"Kilkari Maternity and Child Care Clinic, Kalindi Vihar, Agra",200,14 years,N/A,2025-05-29 03:51:26
agra,Dr. Arun Prakash Gupta,"Arun Prakash Gupta Clinic, Ram Bagh, Agra",N/A,45 years,N/A,2025-05-29 03:51:26
agra,Dr. Swati Dwivedi,"Dr. Sangeeta Mother And Child Care Centre, Sikandra, Agra",200,13 years,N/A,2025-05-29 03:51:26
agra,Dr. Preeti Jain,"Dr Anurag Jains Clinic, Delhi Gate, Agra",400,18 years,N/A,2025-05-29 03:51:27
agra,Dr. Abhishek Gupta,"Gupta Child Care And Hospital, Trans Yamuna Colony, Agra",N/A,20 years,N/A,2025-05-29 03:51:27
agra,Dr. Akansha Arora,"Ujala Cygnus Rainbow Hospital, Sikandra, Agra",400,11 years,N/A,2025-05-29 03:51:27
agra,Dr. Sajal Gupta,"Fh Medical College Etmadpur Agra, Etmadpur, Agra",300,7 years,N/A,2025-05-29 03:51:27
amritsar,Dr. Naresh Grover,"Apollo Cradle  Childrens Hospital, INA Colony, Amritsar",500,38 years,N/A,2025-05-29 04:03:31
amritsar,Dr. Rajneesh Kapoor,"Apollo Cradle  Childrens Hospital, INA Colony, Amritsar",500,28 years,N/A,2025-05-29 04:03:32
amritsar,Dr. Latika Uppal,"Apollo Cradle  Childrens Hospital, INA Colony, Amritsar",400,16 years,N/A,2025-05-29 04:03:32
amritsar,Dr. Raj Kumar,"Apollo Cradle  Childrens Hospital, INA Colony, Amritsar",300,34 years,N/A,2025-05-29 04:03:32
amritsar,Dr. Ashna Kumar,"Kmaxx American Hospital, Mall Road, Amritsar",1500,8 years,N/A,2025-05-29 04:03:32
amritsar,Dr. Rajiv Gupta,"Dr.Rajiv Guptas Children Hospital, Amritsar, Amritsar",600,39 years,N/A,2025-05-29 04:03:32
amritsar,Dr. Gurmeet Singh,"Dr Gurmeet Child Care Centre, Sultanwind, Amritsar",300,25 years,N/A,2025-05-29 04:03:32
amritsar,Dr. Kunal Mahajan,"Dr. Kunal Mahajan Children Hospital, Chheharta, Amritsar",200,15 years,N/A,2025-05-29 04:03:32
amritsar,Dr. Amandeep Singh,"Dr. Amandeep Singhs Clinic, Amritsar, Amritsar",200,25 years,N/A,2025-05-29 04:03:32
amritsar,Dr. Dilraj Kaur Kahlon,"Child Care  Pediatric Hematology Oncology Clinic, Amritsar, Amritsar",200,19 years,N/A,2025-05-29 04:03:32
amritsar,Dr. Sudesh Sharma,"Dr. Sudesh Sharmas Clinic, Amritsar, Amritsar",100,50 years,N/A,2025-05-29 04:04:07
amritsar,Dr. Rupinder Jaswal,"Kiwi Children Hospital, Ranjit Avenue, Amritsar",100,15 years,N/A,2025-05-29 04:04:07
amritsar,Dr. Vijay Kumar Sethi,"C Zon Hospital, Ajnala, Amritsar",100,45 years,N/A,2025-05-29 04:04:07
amritsar,Dr. Lucky Bhalla Sehgal,"Sehgal Neuro  Child Care Centre, EPPF Basant Avenue, Amritsar",200,14 years,N/A,2025-05-29 04:04:07
amritsar,Dr. Pradeep Bhatia,"Complete Child Healthcare Centre, Amritsar, Amritsar",400,12 years,N/A,2025-05-29 04:04:07
amritsar,Dr. Gunjanpreet Kaur,"Sri Guru Ram Das Charitable Hospital, Sultanwind, Amritsar",200,5 years,N/A,2025-05-29 04:04:07
aurangabad,Dr. Atish Ladda,"Samarth Hospital, Garkheda, Aurangabad",150,22 years,N/A,2025-05-29 04:05:42
aurangabad,Dr. V.K Kadam,"Tirupati Childrens Clinic, Pundalik Nagar, Aurangabad",250,45 years,N/A,2025-05-29 04:05:42
aurangabad,Dr. Ashfaq Siddiqui,"Badar Children Hospital, Shah Bazar, Aurangabad",100,25 years,N/A,2025-05-29 04:05:42
aurangabad,Dr. Sandeep Saraf,"Dr Sandeep Sarafs Sai Superspeciality Clinic, Aurangabad Railway Station, Aurangabad",500,18 years,N/A,2025-05-29 04:05:42
aurangabad,Dr. Vinod,"Chirayoo Childrens Hospital, Cidco Colony, Aurangabad",200,25 years,N/A,2025-05-29 04:05:42
aurangabad,Dr. Syed Abdul Wahab Abdul Aziz,"Syed Child Clinic, Ganesh Colony, Aurangabad",100,21 years,N/A,2025-05-29 04:05:42
aurangabad,Dr. Rafi Meman,"Colors Hospital, Aurangpura, Aurangabad",100,18 years,N/A,2025-05-29 04:05:42
aurangabad,Dr. Deepak Lohiya,"Lohiya Childrens Hospital, Session Court, Aurangabad",150,25 years,N/A,2025-05-29 04:05:42
aurangabad,Dr. Sachin Subhash Dhule,"Shubham Childrens Hospital  Critical Care Centre, Cidco Colony, Aurangabad",200,13 years,N/A,2025-05-29 04:05:42
aurangabad,Dr. Smita Kulkarni,"Bhakti Childreans Hospital, Garkheda, Aurangabad",200,22 years,N/A,2025-05-29 04:05:43
aurangabad,Dr. Jay Malani,"Sparsh Kids Care, Aurangabad, Aurangabad",150,20 years,N/A,2025-05-29 04:06:19
aurangabad,Dr. Asavati Kaushik,"Shree Clinic, Jawahar Colony, Aurangabad",150,27 years,N/A,2025-05-29 04:06:19
aurangabad,Dr. Md Sadiq Shaikh,"Arif Childrens Hospital, Shah Bazar, Aurangabad",250,26 years,N/A,2025-05-29 04:06:19
aurangabad,Dr. Pandurang Takle,"Vatsalya Bal Rugnalaya, Garkheda, Aurangabad",100,19 years,N/A,2025-05-29 04:06:19
aurangabad,Dr. Shripad Dakhane,"Endoworld Hospital, Chilkalthana, Aurangabad",300,14 years,N/A,2025-05-29 04:06:19
aurangabad,Dr. Prashant Chavan Patil,"Chavan Hospital, Cidco, Aurangabad",700,13 years,N/A,2025-05-29 04:06:19
aurangabad,Dr. Vidyasagar Kohirepatil,"Kohire Bal Rugnalay And Maternity Home, Padegaon, Aurangabad",200,13 years,N/A,2025-05-29 04:06:19
aurangabad,Dr. Ashwini Kundalwal,"Kundalwals Clinic, Aurangabad, Aurangabad",400,16 years,N/A,2025-05-29 04:06:19
aurangabad,Dr. Khaled Shaikh,"NewLife Clinic, Kiradpura, Aurangabad",200,21 years,N/A,2025-05-29 04:06:19
aurangabad,Dr. Shaikh A Rizwan,"Navjeevan Balrugnalay, Cidco, Aurangabad",300,12 years,N/A,2025-05-29 04:06:19
bangalore,Nano Hospital,N/A,400,28 years,N/A,2025-05-29 04:07:16
bangalore,Dr. Supraja Chandrasekar,"DHEE Hospitals, Kanakpura Road, Bangalore",750,22 years,N/A,2025-05-29 04:07:54
bangalore,Dr. Vishwas S N,"Natus Women and Children Hospital, Sarjapur Road, Bangalore",700,18 years,N/A,2025-05-29 04:07:54
bangalore,Dr. Adarsh Somashekar,"Ovum Woman  Child Speciality Hospital, Kalyan Nagar, Bangalore",850,28 years,N/A,2025-05-29 04:07:54
bangalore,Dr. Keshav Murthy,"Jayashree Multispeciality Hospital, Begur, Bangalore",500,24 years,N/A,2025-05-29 04:07:54
bangalore,Dr. Muzfar Ahmed Yaragatti,"DHEE Hospitals, Kanakpura Road, Bangalore",600,21 years,N/A,2025-05-29 04:07:54
bangalore,Dr. Sampat Kumar Shettigar,"Kinder Womens Hospital and Fertility Centre, Whitefield, Bangalore",900,16 years,N/A,2025-05-29 04:07:54
bangalore,Dr. Sai Shankar,"Ovum Woman  Child Speciality Hospital, Kalyan Nagar, Bangalore",750,22 years,N/A,2025-05-29 04:07:54
bangalore,Dr. Lingaraj Mulage,"Ovum Woman  Child Speciality Hospital, Banashankari, Bangalore",750,16 years,N/A,2025-05-29 04:07:54
bangalore,Dr. Narendra N S,"Oyster Mother and Child Hospital, HRBR Layout, Bangalore",700,18 years,N/A,2025-05-29 04:07:55
bangalore,Dr. Maneesha P H,"Ovum Woman  Child Speciality Hospital, Banashankari, Bangalore",750,23 years,N/A,2025-05-29 04:07:55
bangalore,Dr. Brinda E,"SPANDANA HEART AND SUPER SPECIALITY HOSPITAL, Sarjapur Road, Bangalore",750,17 years,N/A,2025-05-29 04:08:30
bangalore,Dr. Mallikarjun R Patil,"DHEE Hospitals, Kanakpura Road, Bangalore",750,25 years,N/A,2025-05-29 04:08:30
bangalore,Dr. Anil Kumar B N,"Ovum Woman  Child Speciality Hospital, Kalyan Nagar, Bangalore",750,18 years,N/A,2025-05-29 04:08:30
bangalore,Dr. Niranjan Kumar P,"Trustwell Hospitals, Sampangiramnagar, Bangalore",800,20 years,N/A,2025-05-29 04:08:30
bangalore,Dr. Shazia,"Altius Hospitals, HBR Layout, Bangalore",800,15 years,N/A,2025-05-29 04:08:30
bangalore,Dr. Prasanna Naik,"SPANDANA HEART AND SUPER SPECIALITY HOSPITAL, Sarjapur Road, Bangalore",750,17 years,N/A,2025-05-29 04:08:30
bangalore,Dr. Nalini G Shenoy,"The Bangalore Hospital, Basavanagudi, Bangalore",800,48 years,N/A,2025-05-29 04:08:30
bangalore,Dr. Sailaja V,"Nano Hospitals, Hulimavu, Bangalore",500,19 years,N/A,2025-05-29 04:08:30
bangalore,Dr. Sahana Shankar,"DHEE Hospitals, Kanakpura Road, Bangalore",900,17 years,N/A,2025-05-29 04:08:31
bangalore,Dr. Venkat S. Reddy,"Ovum Woman and Child Speciality Hospital, Kothanur, Bangalore",800,28 years,N/A,2025-05-29 04:08:31
bhopal,Dr. Vikrant Singh Raghuvanshi,"L B S Hospital, Motia Talab Road, Bhopal",350,13 years,N/A,2025-05-29 04:09:14
bhopal,Dr. K. F. Kazmi,"Parwarish, Subhash Nagar, Bhopal",400,55 years,N/A,2025-05-29 04:09:15
bhopal,Dr. Hari Shankar,"Sun Shine Clinic, Kamla Park, Bhopal",400,31 years,N/A,2025-05-29 04:09:15
bhopal,Dr. Syed Zaheer Ahmed,"Nidan Poly Clinic, Jahangirabad, Bhopal",150,64 years,N/A,2025-05-29 04:09:15
bhopal,Dr. Akhil Singh,"Dulaar Children Hospital, Bagh Swaniya, Bhopal",200,14 years,N/A,2025-05-29 04:09:15
bhopal,Dr. Shweta Goyal,"Manan Child Care Hospital, Lalghati, Bhopal",200,19 years,N/A,2025-05-29 04:09:15
bhopal,Dr. Veena Arora,"Dr. Veena Arora Clinic, Bharat Heavy Electricals (BHEL), Bhopal",200,55 years,N/A,2025-05-29 04:09:15
bhopal,Dr. Lalish Jhavar,"Kanha Maternity  Child Care Hospital, Trilanga, Bhopal",300,20 years,N/A,2025-05-29 04:09:15
bhopal,Dr. S S Rajput,"Nilay Hospital, Bagh Swaniya, Bhopal",500,39 years,N/A,2025-05-29 04:09:15
bhopal,Dr. Satish Maravi,"Kilkari Kids Clinic, Indrapuri, Bhopal",400,18 years,N/A,2025-05-29 04:09:15
bhopal,Dr. Ankita Katiyar,"Born Bone Clinic, Minal Residency, Bhopal",400,8 years,N/A,2025-05-29 04:09:52
bhopal,Dr. Nitesh upadhyay,"Upadhyay Skin and Child Care Clinic, Lalghati, Bhopal",300,15 years,N/A,2025-05-29 04:09:52
bhopal,Dr. Amit P. Agarwal,"Matratva Hospital, Kolar Road, Bhopal",250,22 years,N/A,2025-05-29 04:09:52
bhopal,Dr. Rajeev Nath,"Child Care Centre  Hospital, Kolar Road, Bhopal",250,43 years,N/A,2025-05-29 04:09:52
bhopal,Dr. Priyanka Chaturvedi,"Divyanka Children Hospital, Minal Residency, Bhopal",600,13 years,N/A,2025-05-29 04:09:52
bhopal,Dr. Brig Ashok Saxena,"Bansal Hospital, Shahpura, Bhopal",500,39 years,N/A,2025-05-29 04:09:52
bhopal,Dr. Amit Agarwal,"ATHARVA CLINIC, Ayodhaya Nagar, Bhopal",200,18 years,N/A,2025-05-29 04:09:52
bhopal,Dr. Mahesh Nawani,"Vaccine Clinic, S.I. Lines Shahajanabad, Bhopal",300,35 years,N/A,2025-05-29 04:09:53
bhopal,Dr. Ashwani Syal,"Dr.Ashwani Syal Clinic, Arera Colony, Bhopal",250,41 years,N/A,2025-05-29 04:09:53
bhopal,Dr. Juhi Sonwani,"MJ Hospital, Anand Nagar, Bhopal",250,8 years,N/A,2025-05-29 04:09:53
bhopal,Dr. K.G.Malviya,"Krishna Kids Clinic, Ayodhaya Nagar, Bhopal",250,19 years,N/A,2025-05-29 04:09:53
bhopal,Dr. Shiv Dubey,"Dr. Shiv Dubeys Childcare Clinic, Baghmugalia, Bhopal",300,15 years,N/A,2025-05-29 04:09:53
bhopal,Dr. R K Yadav,"V Care Children Hospital, Kolar Road, Bhopal",200,21 years,N/A,2025-05-29 04:09:53
bhopal,Dr. Chhaya Dave,"Konark Hospital and Research Centre, Arera Colony, Bhopal",300,40 years,N/A,2025-05-29 04:09:53
bhopal,Dr. Chhaya Jain,"Dr. Chaya Jain Kids Clinic, Arera Colony, Bhopal",200,24 years,N/A,2025-05-29 04:09:53
bhopal,Dr. Rohit Joshi,"Bansal Hospital, Shahpura, Bhopal",500,25 years,N/A,2025-05-29 04:09:53
bhopal,Dr. Nawal Kapoor,"Yash Clinic, Kolar Road, Bhopal",300,16 years,N/A,2025-05-29 04:09:53
bhopal,Dr. Asha Dixit,"Dr Dixits Ortho And Paedia Clinic, Arera Colony, Bhopal",200,30 years,N/A,2025-05-29 04:09:53
bhopal,Dr. Pramod Kashyap,"Dr.Pramod Child Care Clinic, Arera Colony, Bhopal",200,25 years,N/A,2025-05-29 04:09:53
bhopal,Dr. Vikas Sachdev,"Dr. Vikas Sachdev Clinic, Bharat Heavy Electricals (BHEL), Bhopal",400,35 years,N/A,2025-05-29 04:09:53
bhopal,Dr. Varun Rai,"Dulaar Child Clinic, Kolar Road, Bhopal",200,16 years,N/A,2025-05-29 04:10:29
bhopal,Dr. Vishal Shrivastava,"Shree Clinic, Piplani, Bhopal",300,13 years,N/A,2025-05-29 04:10:29
bhopal,Dr. Nitin Verma,"Lil Angels Clinic, Kolar Road, Bhopal",200,17 years,N/A,2025-05-29 04:10:29
bhopal,Dr. Astha Tiwari,"Red Cross Hospital, Shivaji Nagar, Bhopal",50,17 years,N/A,2025-05-29 04:10:29
bhopal,Dr. Shrish Shraman Jain,"Mother  Kids Clinic, Lalghati, Bhopal",200,25 years,N/A,2025-05-29 04:10:29
bhopal,Dr. Sukarn Awasthi,"Neerus Child and Family Clinic, Karond, Bhopal",300,11 years,N/A,2025-05-29 04:10:29
bhopal,Dr. Anurag Verma,"Bansal Hospital, Shahpura, Bhopal",500,15 years,N/A,2025-05-29 04:10:29
bhopal,Dr. Mayank Jain,"Navkar Clinic, Ashoka Garden, Bhopal",200,7 years,N/A,2025-05-29 04:10:29
bhopal,Dr. Om Prajapati,"Maa Chandika Child Clinic, Bawadiya Kalan, Bhopal",400,22 years,N/A,2025-05-29 04:10:29
bhopal,Dr. Nasif Ahmed Hashmi,"Hashmi Clinic, Shahajahanabad, Bhopal",200,6 years,N/A,2025-05-29 04:10:29
chandigarh,Bedi Hospital,N/A,800,42 years,N/A,2025-05-29 04:10:41
chandigarh,Dr. R. P. Bansal,"Children Health Clinic  Vaccination Center, Sector 34, Chandigarh",600,39 years,N/A,2025-05-29 04:11:18
chandigarh,Dr. Vikas Bhalla,"Vikas Bhallas Clinic, Zirakpur, Chandigarh",400,17 years,N/A,2025-05-29 04:11:18
chandigarh,Dr. Pankaj Raina,"Niramaya Pediatric Centre, Zirakpur, Chandigarh",400,25 years,N/A,2025-05-29 04:11:18
chandigarh,Dr. Sandeep Sharma,"Omni Clinics And Diagnostics, Sector 34, Chandigarh",350,12 years,N/A,2025-05-29 04:11:18
chandigarh,Dr. Sunny Narula,"IVF  Infertility Centre, Sector 62, Chandigarh",500,29 years,N/A,2025-05-29 04:11:18
chandigarh,Dr. Diljot Singh Bedi,"Dr Bedis Pediatric  Psychiatric Clinic, Sector 37 C, Chandigarh",800,22 years,N/A,2025-05-29 04:11:18
chandigarh,Dr. Ashish Sharma,"Trinity Hospital and Medical Research Institute, Zirakpur, Chandigarh",400,12 years,N/A,2025-05-29 04:11:18
chandigarh,Dr. Bijaylaxmi Behera,"Chaitanya Hospital - Chandigarh, Sector 44, Chandigarh",700,15 years,N/A,2025-05-29 04:11:18
chandigarh,Dr. K Babu,"Sangeeta Nursing Home, Sector 21, Chandigarh",500,17 years,N/A,2025-05-29 04:11:18
chandigarh,Dr. Sumeet Sharma,"VCare Hospital, Zirakpur, Chandigarh",300,11 years,N/A,2025-05-29 04:11:19
chandigarh,Dr. Vishal Dublish,"Shree Child Care, Zirakpur, Chandigarh",300,25 years,N/A,2025-05-29 04:11:54
chennai,Dr. Varadarajulu Reddy Gadi,"Billroth Hospitals, Shenoy Nagar, Chennai",400,54 years,N/A,2025-05-29 04:12:39
chennai,Dr. Meena S,"Kannapa Memorial Hospital, Kilpauk, Chennai",500,16 years,N/A,2025-05-29 04:12:39
chennai,Dr. Muthukumar,"Apollo Speciality Hospital, Vanagaram, Chennai",800,16 years,N/A,2025-05-29 04:12:39
chennai,Dr. Cheri Mathews John,"Angels Speciality Clinic, Anna Nagar, Chennai",450,31 years,N/A,2025-05-29 04:12:40
chennai,Dr. Latha Dhathathri,"Apollo Spectra Hospital, Alwarpet, Chennai",800,32 years,N/A,2025-05-29 04:12:40
chennai,Dr. Krishna Priya,"Apollo Speciality Hospital, Vanagaram, Chennai",1000,29 years,N/A,2025-05-29 04:12:40
chennai,Dr. Kalaivani Ganesan,"Dr. Mehtas Hospitals, Chetpet, Chennai",700,19 years,N/A,2025-05-29 04:12:40
chennai,Dr. Deepa Elizabeth Mathew,"Apollo Speciality Hospital, Vanagaram, Chennai",1000,28 years,N/A,2025-05-29 04:12:40
chennai,Dr. Kumutha J,"Apollo Speciality Hospital, Vanagaram, Chennai",800,39 years,N/A,2025-05-29 04:12:40
chennai,Dr. Jisha Susan Babu,"Nurture Pediatric Care, Kolathur, Chennai",500,17 years,N/A,2025-05-29 04:12:40
chennai,Dr. Prashanth Sankar,"Porur Child Health Clinic, Porur, Chennai",400,15 years,N/A,2025-05-29 04:13:16
chennai,Dr. Priya Chandrasekar,"Apollo Spectra Hospital, Alwarpet, Chennai",800,31 years,N/A,2025-05-29 04:13:16
chennai,Dr. M Divya,"Dr. Mehtas Hospitals, Chetpet, Chennai",400,14 years,N/A,2025-05-29 04:13:16
chennai,Dr. Rajendran Ranju Raj,"RRR Child Care Clinic, Poonamalle, Chennai",300,14 years,N/A,2025-05-29 04:13:17
chennai,Dr. Varun Gunasekar,"Thulir Kidz Clinic, Mugalivakkam, Chennai",350,14 years,N/A,2025-05-29 04:13:17
chennai,Dr. Satheesh C,"Apollo Childrens Hospitals, Thousand Lights, Chennai",900,44 years,N/A,2025-05-29 04:13:17
chennai,Dr. Radhalakshmi,"Apollo Childrens Hospitals, Thousand Lights, Chennai",700,27 years,N/A,2025-05-29 04:13:17
chennai,Dr. Shivan Kesavan,"Dr. Mehtas Hospitals, Chetpet, Chennai",700,13 years,N/A,2025-05-29 04:13:17
chennai,Dr. R.Karthik Narayanan,"Rainbow Childrens Hospital, Saidapet, Chennai",800,16 years,N/A,2025-05-29 04:13:17
chennai,Dr. Ragupathy V,"Apollo Childrens Hospitals, Thousand Lights, Chennai",700,57 years,N/A,2025-05-29 04:13:17
chennai,Dr. Daga J N,"Apollo Childrens Hospitals, Thousand Lights, Chennai",1000,59 years,N/A,2025-05-29 04:13:17
chennai,Dr. Chandra Kumar N,"CK Kids, T Nagar, Chennai",700,24 years,N/A,2025-05-29 04:13:17
chennai,Dr. G Kumaravel,"Sheelaa Clinic, Mugalivakkam, Chennai",400,19 years,N/A,2025-05-29 04:13:17
chennai,Dr. V.Anjali,"Kid-E-Care Clinic, Iyyappanthangal, Chennai",300,14 years,N/A,2025-05-29 04:13:17
chennai,Dr. Banu Krishnan,"Apollo Clinic, Velachery, Chennai",1000,45 years,N/A,2025-05-29 04:13:17
chennai,Dr. Anbezhil Subbarayan,"Apollo Childrens Hospitals, Thousand Lights, Chennai",1000,27 years,N/A,2025-05-29 04:13:17
chennai,Dr. Anuradha Sridhar,"Apollo Childrens Hospitals, Thousand Lights, Chennai",2000,27 years,N/A,2025-05-29 04:13:18
chennai,Dr. Dhanasekhar Kesavelu,"Apollo Childrens Hospitals, Thousand Lights, Chennai",1000,25 years,N/A,2025-05-29 04:13:18
chennai,Dr. Ravikumar,"Thooya Women And Child Care Clinic, Kattupakkam, Chennai",400,16 years,N/A,2025-05-29 04:13:18
chennai,Dr. Vasanth Kumar S,"Apollo Clinic, Velachery, Chennai",700,16 years,N/A,2025-05-29 04:13:18
chennai,Dr. S Anbu,"Apollo Hospital, Tondiarpet, Chennai",350,44 years,N/A,2025-05-29 04:13:55
chennai,Dr. Ram kumar,"Cloudnine Hospital, T Nagar, Chennai",850,17 years,N/A,2025-05-29 04:13:55
chennai,Dr. Neeraja Patcha,"Rainbow Childrens Hospital, Thirumangalam, Chennai",850,24 years,N/A,2025-05-29 04:13:55
chennai,Dr. Deepa Easow,"Apollo First Med Hospitals, Kilpauk, Chennai",700,34 years,N/A,2025-05-29 04:13:55
chennai,Dr. Jayakumar Reddy,"Apollo Childrens Hospitals, Thousand Lights, Chennai",500,27 years,N/A,2025-05-29 04:13:55
chennai,Dr. Ganesh.R,"Rainbow Childrens Hospital, Saidapet, Chennai",800,21 years,N/A,2025-05-29 04:13:56
chennai,Dr. Viswanathan M S,"Apollo Childrens Hospitals, Thousand Lights, Chennai",1800,28 years,N/A,2025-05-29 04:13:56
chennai,Dr. Chitra,"Apollo Childrens Hospitals, Thousand Lights, Chennai",1000,27 years,N/A,2025-05-29 04:13:56
chennai,Dr. Pratheeba,"Kodi Clinic, MKB Nagar, Chennai",400,11 years,N/A,2025-05-29 04:13:56
coimbatore,Kanavam Child Neuro Clinic,N/A,750,18 years,N/A,2025-05-29 04:14:14
coimbatore,Dr. Charanya Selvan,"Kovaii Childrens Hospital, Saravanampatti, Coimbatore",150,18 years,N/A,2025-05-29 04:14:51
coimbatore,Dr. Karthick Annamalai,"Coimbatore Childrens Hospital, Siddhapudur, Coimbatore",350,19 years,N/A,2025-05-29 04:14:51
coimbatore,Dr. K. Brindha,"Royal Care Superspeciality Hospital, Neelambur, Coimbatore",300,14 years,N/A,2025-05-29 04:14:51
coimbatore,Dr. E.S.Elango,"Elango Child Clinic, Gandhipuram, Coimbatore",100,45 years,N/A,2025-05-29 04:14:51
coimbatore,Dr. S Velmurugan,"Hope Child Neuro Centre, R.S. Puram, Coimbatore",750,33 years,N/A,2025-05-29 04:14:51
coimbatore,Dr. Siva Bharathi,"Kovai Kids Clinic, Saibaba Colony, Coimbatore",350,22 years,N/A,2025-05-29 04:14:51
coimbatore,Dr. Mohamed Suhail,"Premier Medical Centre, Mettupalayam, Coimbatore",200,11 years,N/A,2025-05-29 04:14:51
coimbatore,Dr. K. Neelakandan,"Anbu Child Care Clinic, Uppilipalayam, Coimbatore",100,47 years,N/A,2025-05-29 04:14:51
coimbatore,Dr. N. Kumar,"AB Child Care, Singanallur, Coimbatore",150,27 years,N/A,2025-05-29 04:14:51
coimbatore,Dr. G. Lavanya,"United Clinic for Children, Ganapathy, Coimbatore",100,23 years,N/A,2025-05-29 04:14:51
coimbatore,Dr. N.T. Rajesh,"Aathira Kids clinic  Vaccination Centre, Gandhimaanagar, Coimbatore",100,18 years,N/A,2025-05-29 04:15:27
coimbatore,Dr. Indu Priya K.,"Thiyagu Bone  Baby Care Clinic, Goldwins, Coimbatore",100,17 years,N/A,2025-05-29 04:15:27
coimbatore,Dr. Balakrishnan Rajaiah,"Kovai Medical Center And Hospital, Goldwins, Coimbatore",250,17 years,N/A,2025-05-29 04:15:27
coimbatore,Dr. P. Senthil Kumar,"Shanthi Kids Care Centre, Vadavalli, Coimbatore",150,18 years,N/A,2025-05-29 04:15:27
coimbatore,Dr. Dinesh Prabhu S,"Lifecare Medical Centre, Ganapathy, Coimbatore",250,9 years,N/A,2025-05-29 04:15:27
coimbatore,Dr. Ashok Kumar.S,"Ashwin Hospital, Gandhipuram, Coimbatore",150,17 years,N/A,2025-05-29 04:15:27
coimbatore,Dr. A Pravin,"Kumaran Medical Center, Saravanampatti, Coimbatore",150,18 years,N/A,2025-05-29 04:15:27
coimbatore,Dr. Mohan Das C,"Raani Nursing Home, Selvapuram, Coimbatore",140,20 years,N/A,2025-05-29 04:15:27
coimbatore,Dr. Krishnasamy Sangameswaram,"Rao Hospital, Coimbatore Central, Coimbatore",400,26 years,N/A,2025-05-29 04:15:27
coimbatore,Dr. Lakshmi Sumathi,"Abi Child Care Centre, Pollachi, Coimbatore",300,35 years,N/A,2025-05-29 04:15:28
coimbatore,Dr. K.G. Srikanth,"JG Kids Clinic, Saibaba Colony, Coimbatore",200,32 years,N/A,2025-05-29 04:15:28
coimbatore,Dr. M S Ramaiyah,"M S Ramaiyah Clinic, Kavundampalayam, Coimbatore",300,40 years,N/A,2025-05-29 04:15:28
coimbatore,Dr. S. Stalin,"Amu Baby Clinic, Pappanaickenpalayam, Coimbatore",100,23 years,N/A,2025-05-29 04:15:28
coimbatore,Dr. Shera Fatima,"Dr.Sheras Child Care Clinic, Saravanampatti, Coimbatore",300,11 years,N/A,2025-05-29 04:15:28
coimbatore,Dr. Narayanan. V,"Sriram Childrens Clinic, Vadavalli, Coimbatore",100,23 years,N/A,2025-05-29 04:15:28
coimbatore,Dr. S.Janarthanan,"Sri Sai Child Clinic Vaccination Center, Saravanampatti, Coimbatore",Free Consultation,20 years,N/A,2025-05-29 04:15:28
coimbatore,Dr. Pradeep S,"Deepthi Child Care Clinic, Sundarapuram, Coimbatore",300,15 years,N/A,2025-05-29 04:15:28
coimbatore,Dr. Senthil Velusamy,"consultant Paediatrician, Saravanampatti, Coimbatore",150,17 years,N/A,2025-05-29 04:15:28
coimbatore,Dr. Nithya M,"Puvi Clinic, Coimbatore Aerodrome, Coimbatore",300,16 years,N/A,2025-05-29 04:15:28
coimbatore,Dr. Ramaswami Sethuraman,"K G Hospital, Coimbatore Racecourse, Coimbatore",500,16 years,N/A,2025-05-29 04:15:28
dehradun,Dr. Astha Agrawal,"Max Super Speciality Hospital, Mussoorie, Dehradun",700,20 years,N/A,2025-05-29 04:18:47
dehradun,Dr. Rohit Srivastava,"Max Super Speciality Hospital, Mussoorie, Dehradun",700,9 years,N/A,2025-05-29 04:18:47
dehradun,Dr. Jagdish Prasad Devshali,"J.P Clinic, Ajabpur, Dehradun",300,39 years,N/A,2025-05-29 04:18:48
dehradun,Dr. Nitesh,"Grace Clinic, Nehrugram, Dehradun",300,13 years,N/A,2025-05-29 04:18:48
dehradun,Dr. Shruti Kumar,"Aksh Child Developmental Center, Ballupur, Dehradun",1000,24 years,N/A,2025-05-29 04:18:48
dehradun,Dr. Major Gaurav Mukhija,"Nalanda Healthcare, Defence Colony, Dehradun",500,12 years,N/A,2025-05-29 04:18:48
dehradun,Dr. Nitika Mittal,"Healing Touch Hospital, Sahstradhara, Dehradun",500,22 years,N/A,2025-05-29 04:18:48
dehradun,Dr. Richa Joshi,"Sanjay Medicos  Clinic, Ballupur, Dehradun",500,11 years,N/A,2025-05-29 04:18:48
dehradun,Dr. Madhusudan Garg,"Garg Clinic, Mussoorie, Dehradun",400,46 years,N/A,2025-05-29 04:18:48
dehradun,Dr. Abhas Gupta,"Kosha Clinics, Dalanwala, Dehradun",500,7 years,N/A,2025-05-29 04:18:48
