City,Clinic,Location,Fee,Experience,Phone,Timestamp
dehradun,Dr. Kunal Das,"Himalayan institute of medical science, Doiwala, Dehradun",500,21 years,N/A,2025-05-29 04:19:23
dhanbad,Dr. Shambhavi Narayan,"Shwet Shree Clinic, Saraidhela, Dhanbad",300,11 years,N/A,2025-05-29 04:20:54
dhanbad,Dr. Brij Bhushan Sahni,"Kumar  Associates, Dhanbad Bazar, Dhanbad",300,46 years,N/A,2025-05-29 04:20:54
faridabad,The Healing Touch Pediatric And Orthopaedic Clinic,N/A,400,17 years,N/A,2025-05-29 04:22:42
faridabad,Dr. Shweta Pathak,"Compassion Child Clinic, Sector 85, Faridabad",500,20 years,N/A,2025-05-29 04:23:18
faridabad,Dr. Prabhat Kumar Bajpai,"Metro Hospital, Sector-16a, Faridabad",600,20 years,N/A,2025-05-29 04:23:18
faridabad,Dr. Harjeet Kaur,"Kilkari Childrens Clinic, Sector 11, Faridabad",1000,35 years,N/A,2025-05-29 04:23:18
faridabad,Dr. Sumit Chakravarty,"Asian Institute of Medical Sciences, Sector 21A, Faridabad",500,20 years,N/A,2025-05-29 04:23:19
faridabad,Dr. Divya Agarwal,"The Healing Touch Pediatric And Orthopaedic Clinic, Sainik Colony, Faridabad",400,17 years,N/A,2025-05-29 04:23:19
faridabad,Dr. Sushil Shukla,"Asian Institute of Medical Sciences, Sector 21A, Faridabad",500,23 years,N/A,2025-05-29 04:23:19
faridabad,Dr. Madhu Garg,"Metro Hospital, Sector-16a, Faridabad",600,47 years,N/A,2025-05-29 04:23:19
faridabad,Dr. Abhilash Agrawal,"Vardan Clinic, Surajkund, Faridabad",600,24 years,N/A,2025-05-29 04:23:19
faridabad,Dr. Mohitesh Shrivastava,"Medical Sathi Family Clinic, Sector 86, Faridabad",400,17 years,N/A,2025-05-29 04:23:19
faridabad,Dr. Anjali Jain Vatsa,"Mediline Clinic, Sector 82, Faridabad",400,19 years,N/A,2025-05-29 04:23:19
faridabad,Dr. Sumit Dagar,"Luxmi Clinic, Jawahar Colony, Faridabad",500,6 years,N/A,2025-05-29 04:23:19
faridabad,Dr. Shailender Parashar,"Devi Child Clinic, Sector-19, Faridabad",200,14 years,N/A,2025-05-29 04:23:19
faridabad,Dr. Vishal Soni,"Shivalik Hospital, Sector 37, Faridabad",250,19 years,N/A,2025-05-29 04:23:19
faridabad,Dr. Anjali Jain,"Dr. Anjali Jain Clinic, Sector-29, Faridabad",200,19 years,N/A,2025-05-29 04:23:19
faridabad,Dr. Hitesh Pant,"Fortis Escorts Hospital, New Industrial Town, Faridabad",650,32 years,N/A,2025-05-29 04:23:19
faridabad,Dr. Amit Gupta,"Fortis Escorts Hospital, New Industrial Town, Faridabad",650,31 years,N/A,2025-05-29 04:23:20
faridabad,Dr. Tausif Iqbal,"True Care Health Clinic, Sector 88, Faridabad",800,11 years,N/A,2025-05-29 04:23:20
faridabad,Dr. B.K.Bansal,"Bansal Child Care Centre, Sector 22, Faridabad",500,23 years,N/A,2025-05-29 04:23:20
faridabad,Dr. Abhishek Singh Rauthan,"Child Care Clinic-Dr. Abhishek Singh Rauthan, Sector 28, Faridabad",300,10 years,N/A,2025-05-29 04:23:20
faridabad,Dr. Dilip Kumar Jha,"Dr Dilip Hospital, Sector 28, Faridabad",500,34 years,N/A,2025-05-29 04:23:56
faridabad,Dr. Sanjay Gopal Sharma,"Sewa Clinic, Gonchhi, Faridabad",500,29 years,N/A,2025-05-29 04:23:56
faridabad,Dr. Anil Kumar Nage,"Bachpan Clinic, Ballabgarh, Faridabad",400,25 years,N/A,2025-05-29 04:23:56
faridabad,Dr. Lalit Kumar,"Apurva Hospital, New Industrial Town, Faridabad",600,14 years,N/A,2025-05-29 04:23:56
faridabad,Dr. Deepak Kumar Garg,"Baby Care  Multispecialty Hospital, Ballabgarh, Faridabad",400,17 years,N/A,2025-05-29 04:23:56
faridabad,Dr. Ritu Chhabra,"The Panacea Clinic, Sector 17, Faridabad",200,N/A,N/A,2025-05-29 04:23:56
faridabad,Dr. Priyanka Madaan,"Amrita Hospital, Sector 88, Faridabad",1500,14 years,N/A,2025-05-29 04:23:56
gandhinagar,Dr. Nirav N Parmar,"Navodaya Children Hospital, Adalaj, Gandhinagar",500,11 years,N/A,2025-05-29 04:24:38
gandhinagar,Dr. Dhara Patel,"Dharas Clinic, Kudasan, Gandhinagar",100,12 years,N/A,2025-05-29 04:24:38
gandhinagar,Dr. Divy Patel,"Star Kids Children Hospital  Child Dental Care, Kudasan, Gandhinagar",400,10 years,N/A,2025-05-29 04:24:38
gandhinagar,Dr. Maulik Kapadiya,"Aashka Multispeciality Hospital, Sargasan, Gandhinagar",400,7 years,N/A,2025-05-29 04:24:38
gandhinagar,Dr. Niravkumar Nanavati,"Rudraksh Children Hospital, Sector 24, Gandhinagar",500,8 years,N/A,2025-05-29 04:24:39
ghaziabad,Medical Mantra Healthcare,N/A,500,21 years,N/A,2025-05-29 04:26:22
ghaziabad,Dr. Gunjan Srivastava,"Sunrise Mediclinic, Crossings Republik, Ghaziabad",700,12 years,N/A,2025-05-29 04:26:58
ghaziabad,Dr. Syed Shad Moshin,"Apollo Cradle  Childrens Hospital, Indirapuram, Ghaziabad",1000,16 years,N/A,2025-05-29 04:26:58
ghaziabad,Dr. Megha Rustagi,"Manipal Hospital, Ghaziabad (formerly Columbia Asia Hospital), Pandav Nagar, Ghaziabad",800,8 years,N/A,2025-05-29 04:26:58
ghaziabad,Dr. Anand Singh,"Max Super Speciality Hospital, Vaishali, Ghaziabad",600,12 years,N/A,2025-05-29 04:26:58
ghaziabad,Dr. Bijender singh,"Mother and Kidz Clinic, Vaishali, Ghaziabad",600,23 years,N/A,2025-05-29 04:26:58
ghaziabad,Dr. Vidyut Bhatia,"Max Super Speciality Hospital, Vaishali, Ghaziabad",1500,28 years,N/A,2025-05-29 04:26:58
ghaziabad,Dr. Abhishek Roy,"Apollo Cradle  Childrens Hospital, Indirapuram, Ghaziabad",1200,18 years,N/A,2025-05-29 04:26:58
gwalior,Dr. Sudhir Dixit,"Apollo Spectra Hospitals, Gwalior City, Gwalior",300,19 years,N/A,2025-05-29 04:28:29
gwalior,Dr. Parag Srivastava,"Dr. Parag Srivastava Clinic, Thatipur, Gwalior",200,27 years,N/A,2025-05-29 04:28:29
gwalior,Dr. Manish Kuber,"Kuber Bal Chikitsalay, Morar, Gwalior",250,17 years,N/A,2025-05-29 04:28:29
gwalior,Dr. Vishwas Mudgal,"Sparsh, Deen Dayal Nagar, Gwalior",200,22 years,N/A,2025-05-29 04:28:29
gwalior,Dr. Jyoti Sharma,"Childrens Hospital, Vinay Nagar, Gwalior",200,15 years,N/A,2025-05-29 04:28:29
gwalior,Dr. Anil Sharma,"Haematology Haemato-Oncology Centre, Lashkar, Gwalior",650,14 years,N/A,2025-05-29 04:28:29
gwalior,Dr. Dheerendra Singh Sikarwar,"Natkhat -The Child Clinic, Thatipur, Gwalior",300,8 years,N/A,2025-05-29 04:28:29
gwalior,Dr. Prakash Vir Arya,"Phulwari Mother  Child Clinic, Tansen Nagar, Gwalior",400,34 years,N/A,2025-05-29 04:28:29
gwalior,Dr. Suhas Dhonde,"Niramaya Nursing Home Infertility Centre, Lashkar, Gwalior",500,39 years,N/A,2025-05-29 04:28:29
gwalior,Dr. Rohan Sapra,"Kilkari Hospital, Ajaypur, Gwalior",300,5 years,N/A,2025-05-29 04:28:30
gwalior,Dr. Satyendra Bansal,"Dr Bansal Hospital, Govindpuri, Gwalior",200,15 years,N/A,2025-05-29 04:29:06
gwalior,Dr. Archana Gupta,"Archana Health Care, Gwalior City, Gwalior",350,31 years,N/A,2025-05-29 04:29:07
gwalior,Dr. Vikram Jeet Singh Bhadoria,"Sharda Kids Clinic, Sirol, Gwalior",300,11 years,N/A,2025-05-29 04:29:07
gwalior,Dr. Devraj Singh,"Rakshit Child Care Clinic, Deen Dayal Nagar, Gwalior",200,5 years,N/A,2025-05-29 04:29:07
gwalior,Dr. Manoj Bansal,"Samarth Womens And Child Health Center, Gwalior City, Gwalior",200,19 years,N/A,2025-05-29 04:29:07
gwalior,Dr. Satvik Bansal,"NEST- Shabd Pratap Hospital, Lashkar, Gwalior",500,11 years,N/A,2025-05-29 04:29:07
hyderabad,G M Clinic,N/A,500,24 years,N/A,2025-05-29 04:30:07
hyderabad,Dr. Malin Begum Shaik,"Little Stars and She Hospital, Banjara Hills, Hyderabad",700,18 years,N/A,2025-05-29 04:30:42
hyderabad,Dr. Karimunnisa Begum,"Butterfly Hospitals, Mehadipatnam, Hyderabad",600,21 years,N/A,2025-05-29 04:30:42
hyderabad,Dr. Vasanth Kumar Chakilam,"Butterfly Hospitals, Mehadipatnam, Hyderabad",600,23 years,N/A,2025-05-29 04:30:42
hyderabad,Dr. Kamalakar,"Lotus Hospitals  Kukatpally, Kukatpally, Hyderabad",750,20 years,N/A,2025-05-29 04:30:42
hyderabad,Dr. Taheer Shaik,"Apollo Cradle  Childrens Hospital, Kondapur, Hyderabad",850,19 years,N/A,2025-05-29 04:30:42
hyderabad,Dr. Srikanth Darisetty,"Dr. D . Srikanth clinic, Malkajgiri, Hyderabad",550,15 years,N/A,2025-05-29 04:30:42
hyderabad,Dr. Uday Kumar Sahu,"Savitri Childrens Clinic, Kondapur, Hyderabad",800,32 years,N/A,2025-05-29 04:30:42
hyderabad,Dr. Narender Tatikonda,"Aster Prime Hospital, Ameerpet, Hyderabad",500,28 years,N/A,2025-05-29 04:30:42
hyderabad,Dr. Sharmila K,"Apollo Cradle  Childrens Hospital, Jubilee Hills, Hyderabad",700,29 years,N/A,2025-05-29 04:30:43
hyderabad,Dr. S Sridevi,"Apex Medical and Dental Centre, Saidabad, Hyderabad",500,49 years,N/A,2025-05-29 04:30:43
hyderabad,Dr. D. Srikanth Reddy,"Childrens Clinic  Vaccination Centre, Ramanthapur, Hyderabad",600,24 years,N/A,2025-05-29 04:31:18
hyderabad,Dr. Mukesh Kumar Khetan,"Rainbow Childrens Hospital, Financial District, Hyderabad",850,24 years,N/A,2025-05-29 04:31:18
hyderabad,Dr. Neelima K V A R,"Rainbow Childrens Hospital, Hyder Nagar, Hyderabad",1000,25 years,N/A,2025-05-29 04:31:18
hyderabad,Dr. P.K.Rajeev,"Shreyass Clinic, Malkajgiri, Hyderabad",900,20 years,N/A,2025-05-29 04:31:18
hyderabad,Dr. Ashwin Reddy,"Ashwin Children Hospital, Secunderabad, Hyderabad",450,19 years,N/A,2025-05-29 04:31:18
hyderabad,Dr. Jagan Mohan Varakala,"Paramitha Women And Children Hospital, Madinaguda, Hyderabad",500,14 years,N/A,2025-05-29 04:31:18
hyderabad,Dr. Prasanna Lakshmi Mettupalli,"Gnanvis Child Care Paediatric Clinic, Kondapur, Hyderabad",700,12 years,N/A,2025-05-29 04:31:18
hyderabad,Dr. Ganta Rami Reddy,"Neo Asian Clinics, Kondapur, Hyderabad",500,13 years,N/A,2025-05-29 04:31:18
hyderabad,Dr. Rishivardhan Reddy,"Aster Prime Hospital, Ameerpet, Hyderabad",500,9 years,N/A,2025-05-29 04:31:18
hyderabad,Dr. K S Nagaraju,"Vijaya Nursing Home, Chanda Nagar, Hyderabad",650,27 years,N/A,2025-05-29 04:31:18
hyderabad,Dr. Madhavi RS,"Cloudnine Hospital (formerly The Birthplace), Banjara Hills, Hyderabad",1100,22 years,N/A,2025-05-29 04:31:18
hyderabad,Dr. Bhargavi Arun,"Ragavi Hospital, Kukatpally, Hyderabad",700,18 years,N/A,2025-05-29 04:31:18
hyderabad,Dr. Satish Reddy Hashampalli,"Cloudnine Hospital (formerly The Birthplace), Banjara Hills, Hyderabad",1100,12 years,N/A,2025-05-29 04:31:19
hyderabad,Dr. Sujatha Reddy Veeram,"Vijaya Nursing Home, Chanda Nagar, Hyderabad",550,13 years,N/A,2025-05-29 04:31:19
hyderabad,Dr. Koteswar Rao,"Apollo Cradle  Childrens Hospital, Jubilee Hills, Hyderabad",800,33 years,N/A,2025-05-29 04:31:19
hyderabad,Dr. Aparna Reddy,"Rainbow Childrens Hospital, Banjara Hills, Hyderabad",600,30 years,N/A,2025-05-29 04:31:19
hyderabad,Dr. Chandra Shekhar,"Rainbow Childrens Hospital, Hyder Nagar, Hyderabad",900,27 years,N/A,2025-05-29 04:31:19
hyderabad,Dr. B Ashrita Reddy,"Hope Childrens Hospital, Basheerbagh, Hyderabad",700,11 years,N/A,2025-05-29 04:31:19
hyderabad,Dr. Ragini Manju Shree,"Hope Childrens Hospital, Basheerbagh, Hyderabad",700,11 years,N/A,2025-05-29 04:31:19
hyderabad,Dr. V Parmeshwar Reddy,"Hope Childrens Hospital, Basheerbagh, Hyderabad",700,11 years,N/A,2025-05-29 04:31:19
indore,Dr. Anagha Bhagwat,"Apollo Hospitals, Vijay Nagar, Indore",700,27 years,N/A,2025-05-29 04:32:10
indore,Dr. Sunil Puraswani,"Motherhood Hospital, Malviya Nagar, Indore",800,10 years,N/A,2025-05-29 04:32:10
indore,Dr. Ashish Jaiswal,"Motherhood Hospital, Malviya Nagar, Indore",900,23 years,N/A,2025-05-29 04:32:10
indore,Dr. Meena Vijayvergiya,"Dr. Meena Vijayvergiyas Chamber, Bengali Square, Indore",500,36 years,N/A,2025-05-29 04:32:10
indore,Dr. Manju Mehta,"Mehta Hospital, Sapna Sangeeta, Indore",500,36 years,N/A,2025-05-29 04:32:10
indore,Dr. Ankur Khandelwal,"Sparsham Clinic, Vaibhav Nagar, Indore",400,14 years,N/A,2025-05-29 04:32:11
indore,Dr. K. K. Arora,"Clinic for Mother  Child, Sapna Sangeeta, Indore",300,42 years,N/A,2025-05-29 04:32:11
indore,Dr. Himanshu Kelkar,"Dr. Himanshu Kelkars Clinic, Vijay Nagar, Indore",250,24 years,N/A,2025-05-29 04:32:11
indore,Dr. Sachin Soni,"First  Care, Vijay Nagar, Indore",250,14 years,N/A,2025-05-29 04:32:11
indore,Dr. Aparna Manjrekar,"Dr. Aparna Manjrekars Clinic, Old Palasia, Indore",300,40 years,N/A,2025-05-29 04:32:11
indore,Dr. Vijay Muchhal,"Shalby Hospital, Old Palasia, Indore",300,38 years,N/A,2025-05-29 04:32:47
indore,Dr. Ashok Garg,"Dr. Ashok Gargs Clinic, Kalani Nagar, Indore",400,39 years,N/A,2025-05-29 04:32:47
indore,Dr. Anupam Gupta,"Dr. Anupam Guptas Clinic, Sapna Sangeeta, Indore",300,23 years,N/A,2025-05-29 04:32:47
indore,Dr. Isha Singh,"Kidz Clinic, Mahalaxmi Nagar Colony, Indore",500,16 years,N/A,2025-05-29 04:32:47
indore,Dr. Sangram Singh,"Dr. Sagram Singhs Clinic, New Palasia, Indore",300,44 years,N/A,2025-05-29 04:32:47
indore,Dr. Virendra Mehar,"Indore Child Care Center, Vijay Nagar, Indore",600,20 years,N/A,2025-05-29 04:32:47
indore,Dr. Bani Barod Choudhari,"Advance joint Replacement and Childcare Clinic, Vijay Nagar, Indore",200,20 years,N/A,2025-05-29 04:32:47
indore,Dr. Manish Verma,"Balaji Clinics, Indore Tukoganj, Indore",400,26 years,N/A,2025-05-29 04:32:47
indore,Dr. Nilesh Jain,"Dr. Nilesh Jains Clinic, I.D.A. Racecourse Road, Indore",500,28 years,N/A,2025-05-29 04:32:47
indore,Dr. Divya Dwivedi,"Sparsh New Born and Child Clinic, Bengali Square, Indore",500,23 years,N/A,2025-05-29 04:32:47
indore,Dr. Sourabh Agrawal,"Shalby Hospital, Old Palasia, Indore",300,16 years,N/A,2025-05-29 04:32:48
indore,Dr. S. K. Awadhiya,"Snahil Clinic, Vijay Nagar, Indore",300,45 years,N/A,2025-05-29 04:32:48
indore,Dr. Sunil Arya,"Dr. Sunil Aryas Clinic, AB Road, Indore",300,21 years,N/A,2025-05-29 04:32:48
indore,Dr. Mukesh Birla,"Dr. Mukesh Birlas Clinic, Indore Tukoganj, Indore",400,35 years,N/A,2025-05-29 04:32:48
indore,Dr. Ravi Ranjan Tripathi,"Sri Sathya Sai Child Heart Center, Vijay Nagar, Indore",Free Consultation,13 years,N/A,2025-05-29 04:32:48
indore,Dr. Shreelekha Joshi,"Dr. Shreelekha Joshis Clinic, Old Palasia, Indore",500,31 years,N/A,2025-05-29 04:32:48
indore,Dr. Ram Ashish Shukla,"Dr. Ram Ashish Shukla Clinic, Musakhedi, Indore",150,20 years,N/A,2025-05-29 04:32:48
indore,Dr. Ratnesh Khare,"Arogya Health care, Indore Manorama Ganj, Indore",200,15 years,N/A,2025-05-29 04:32:48
indore,Dr. Bhupendra Singh Shekhawat,"Dr. Bhupendra Singh Shekhavats Clinic, Vijay Nagar, Indore",400,22 years,N/A,2025-05-29 04:32:48
indore,Dr. Ashvin Wani,"Dr. Ashvin Wanis Clinic, Annapurna Nagar, Indore",150,14 years,N/A,2025-05-29 04:32:48
indore,Dr. Samrat Sahu,"Child Clinic and Vaccination Centre, Bijasan Road, Indore",400,21 years,N/A,2025-05-29 04:33:24
indore,Dr. Pushpendra Chakravarty,"Namah Hospital  Laproscopic Centre, Scheme No 54, Indore",500,11 years,N/A,2025-05-29 04:33:24
indore,Dr. Swapnil Agrawal,"Angel Hospital, Bengali Square, Indore",150,25 years,N/A,2025-05-29 04:33:24
indore,Dr. Shaturghan Panjwani,"Dr. Shaturghan Panjwani Clinic, Sampadak Nai Duniya Kesarbad Road, Indore",80,23 years,N/A,2025-05-29 04:33:24
indore,Dr. Ajay Doshi,"Dr Ajay Doshi Clinic, Tilak Nagar, Indore",300,23 years,N/A,2025-05-29 04:33:24
indore,Dr. Sumeet Soni,"Child Care  Vaccination Centre, Indore Kanadia Road, Indore",250,14 years,N/A,2025-05-29 04:33:24
indore,Dr. Mahendra Singh Rathod,"Niraamay Women And Child Clinic, Tilak Nagar, Indore",400,9 years,N/A,2025-05-29 04:33:24
indore,Dr. Rakesh Jain,"Prem Family Care Clinic, Mahalaxmi Nagar Colony, Indore",50,41 years,N/A,2025-05-29 04:33:25
indore,Dr. Deepak Joshi,"Dr R.K. Joshis Clinic, Sudama Nagar, Indore",150,30 years,N/A,2025-05-29 04:33:25
indore,Dr. Prakash Nagar,"online consultation only, Khajrana, Indore",600,34 years,N/A,2025-05-29 04:33:25
jabalpur,Dr. Sudipto Samaddar,"Child Care Centre, Ranjhi, Jabalpur",500,38 years,N/A,2025-05-29 04:34:11
jabalpur,Dr. Girish Budhrani,"Muskan Child Care, Hathital, Jabalpur",200,27 years,N/A,2025-05-29 04:34:11
jabalpur,Dr. Akhilesh Sorada,"Department Of Paediatrics, Jabalpur City, Jabalpur",200,10 years,N/A,2025-05-29 04:34:11
jabalpur,Dr. Saurabh Jain,"Department Of Paediatrics, Jabalpur City, Jabalpur",200,10 years,N/A,2025-05-29 04:34:11
jaipur,Dr. Deepak Sharma,"Cradle Children Hospital, Vaishali Nagar, Jaipur",500,16 years,N/A,2025-05-29 04:36:33
jaipur,Dr. Sunil Agarwal,"Cradle Children Hospital, Vaishali Nagar, Jaipur",500,15 years,N/A,2025-05-29 04:36:34
jaipur,Dr. Alok Choudhary,"Cradle Children Hospital, Vaishali Nagar, Jaipur",500,20 years,N/A,2025-05-29 04:36:34
jaipur,Dr. Jagveer Singh,"Cradle Children Hospital, Vaishali Nagar, Jaipur",500,16 years,N/A,2025-05-29 04:36:34
jaipur,Dr. Devendra Kumar Sharma,"Cradle Children Hospital, Vaishali Nagar, Jaipur",500,15 years,N/A,2025-05-29 04:36:34
jaipur,Dr. Sharad Goyal,"Maternite Hospital, Pratap Nagar, Jaipur",400,15 years,N/A,2025-05-29 04:36:34
jaipur,Dr. Mohit Poddar,"Cradle Children Hospital, Vaishali Nagar, Jaipur",600,19 years,N/A,2025-05-29 04:36:34
jaipur,Dr. Sonu M. Karol,"Karol Childrens Hospital, Malviya Nagar, Jaipur",500,12 years,N/A,2025-05-29 04:36:34
jaipur,Dr. Sunita,"Cradle Children Hospital, Vaishali Nagar, Jaipur",500,11 years,N/A,2025-05-29 04:36:34
jaipur,Dr. Sushila Gupta,"Narmada Hospital and Diagnostic Centre, Murlipura, Jaipur",500,29 years,N/A,2025-05-29 04:36:34
jaipur,Dr. Arti Yadav,"Cradle Children Hospital, Vaishali Nagar, Jaipur",800,9 years,N/A,2025-05-29 04:37:12
jaipur,Dr. Aruna Jain,"Manipal Hospitals, Vidhyadhar Nagar, Jaipur",500,19 years,N/A,2025-05-29 04:37:12
jaipur,Dr. Sakshi Prabodh,"Cradle Children Hospital, Vaishali Nagar, Jaipur",500,10 years,N/A,2025-05-29 04:37:12
jaipur,Dr. Aashish Saini,"Cradle Children Hospital, Vaishali Nagar, Jaipur",500,8 years,N/A,2025-05-29 04:37:12
jaipur,Dr. Radha Chonsariya,"SRG Hospital, Heerapura, Jaipur",300,13 years,N/A,2025-05-29 04:37:13
jaipur,Dr. Latika Banshiwala,"Maternite Hospital, Pratap Nagar, Jaipur",300,9 years,N/A,2025-05-29 04:37:13
jaipur,Dr. Pravesh Kumar Sharma,"Srishti Medicare Private Limited, Jagatpura Road, Jaipur",400,13 years,N/A,2025-05-29 04:37:13
jaipur,Dr. Kapil Dhawan,"Amar Medical And Research Centre, Mansarovar, Jaipur",500,12 years,N/A,2025-05-29 04:37:13
jaipur,Dr. Keerti Gogra,"Child Cure Clinic, C Scheme, Jaipur",399,3 years,N/A,2025-05-29 04:37:13
jaipur,Dr. Poonam Mehta Goyal,"Goyal Urology And Child Care Centre, Vidhyadhar Nagar, Jaipur",500,18 years,N/A,2025-05-29 04:37:13
jaipur,Dr. Sandip Ray,"Child Care Clinic, Jagatpura, Jaipur",500,15 years,N/A,2025-05-29 04:37:13
jodhpur,Dr. Pradeep Jain,"Vatsalya Child Care, Jodhpur Shastri Nagar, Jodhpur",400,28 years,N/A,2025-05-29 04:38:33
jodhpur,Dr. Ashok Kumar Sharma,"Dr. Ashok Kumar Sharmas Clinic, Jodhpur Chopasni Road, Jodhpur",150,41 years,N/A,2025-05-29 04:38:33
jodhpur,Dr. Pavan Parihar,"Dr.Pavan Parihar Clinic, Shastri Nagar, Jodhpur",Free Consultation,27 years,N/A,2025-05-29 04:38:33
jodhpur,Dr. Anil Kumar,"Dr. Anil Kumars Clinic, Jodhpur Mahamandir, Jodhpur",150,18 years,N/A,2025-05-29 04:38:33
jodhpur,Dr. Ram Khetawat,"Dr. Ram Khetawats Clinic, Jodhpur Chopasni Road, Jodhpur",150,43 years,N/A,2025-05-29 04:38:33
jodhpur,Dr. R K Pamecha,"Medipulse Hospital, Basni, Jodhpur",500,45 years,N/A,2025-05-29 04:38:33
kolkata,Dr. Verma Clinic,N/A,600,45 years,N/A,2025-05-29 04:42:51
kolkata,Dr. Sayantan Bhowmick,"Manipal Hospitals (AMRI Hospitals), Mukundapur, Kolkata",1000,18 years,N/A,2025-05-29 04:43:26
kolkata,Dr. Saumyabrata Acharya,"Manipal Hospital Broadway (AMRI Hospitals), Salt Lake, Kolkata",1200,36 years,N/A,2025-05-29 04:43:26
kolkata,Dr. Arijita Chatterjee,"Desun Hospital, Kasba, Kolkata",750,11 years,N/A,2025-05-29 04:43:26
kolkata,Dr. Dafodil Ghatak,"Apollo Clinic, Beliaghata, Kolkata",700,9 years,N/A,2025-05-29 04:43:26
kolkata,Dr. Dipanjan Halder,"Desun Hospital, Kasba, Kolkata",1000,10 years,N/A,2025-05-29 04:43:26
kolkata,Dr. Sudeshna,"Apollo Clinic, Beliaghata, Kolkata",700,31 years,N/A,2025-05-29 04:43:26
kolkata,Dr. Jinia Saha,"Samaritan Clinic Private Limited, Bhawanipore, Kolkata",1500,7 years,N/A,2025-05-29 04:43:26
kolkata,Dr. Jemsy Jose,"Manipal Hospitals (AMRI Hospitals), Mukundapur, Kolkata",1000,33 years,N/A,2025-05-29 04:43:26
kolkata,Dr. Anirban Basu,"Safe Care Health Services, Tollygunge, Kolkata",400,20 years,N/A,2025-05-29 04:43:26
kolkata,Dr. Shibba Kanti Datta,"Desun Hospital, Kasba, Kolkata",1000,16 years,N/A,2025-05-29 04:43:27
kolkata,Dr. Sabyasachi Bhattacharya,"IRIS Hospital, Baghajatin, Kolkata",1000,25 years,N/A,2025-05-29 04:43:27
kolkata,Dr. Rama Manna,"IRIS Hospital, Baghajatin, Kolkata",700,18 years,N/A,2025-05-29 04:43:27
kolkata,Dr. Kakali Roy,"Apollo Clinic, Beliaghata, Kolkata",700,13 years,N/A,2025-05-29 04:43:27
kolkata,Dr. Hriday De,"Apollo Sugar Clinic, Beliaghata, Kolkata",750,9 years,N/A,2025-05-29 04:43:27
kolkata,Dr. Punit Goenka,"Manipal Hospital Broadway (AMRI Hospitals), Salt Lake, Kolkata",1000,20 years,N/A,2025-05-29 04:43:27
kozhikode,Dr. Rakesh P V,"Sreelakshmi Home Clinic, Malaparamba, Kozhikode",200,35 years,N/A,2025-05-29 04:44:54
kozhikode,Dr. M M Abdussalam,"Dr SalamS New Born And ChildrenS Clinic, Puthiyangadi, Kozhikode",250,26 years,N/A,2025-05-29 04:44:54
kozhikode,Dr. Fazil KT,"Iqraa Community Clinic, Kotuvalli, Kozhikode",200,8 years,N/A,2025-05-29 04:44:54
lucknow,Medanta,N/A,1000,16 years,N/A,2025-05-29 04:46:47
lucknow,Dr. Utkarsh Bansal,"Om Child Care  Vaccination Clinic, Nishath Ganj, Lucknow",500,18 years,N/A,2025-05-29 04:47:22
lucknow,Dr. Sitikant Mohapatra,"The Doctors Arena, Aliganj, Lucknow",500,23 years,N/A,2025-05-29 04:47:22
lucknow,Dr. Umesh Singh,"Shishu Pediatric Clinic, Sector-c Sitapur Rd, Lucknow",200,17 years,N/A,2025-05-29 04:47:22
lucknow,Dr. Ravi Arora,"Tanisha Medical Centre, Aliganj sector K, Lucknow",500,35 years,N/A,2025-05-29 04:47:22
lucknow,Dr. Ashutosh Kumar,"Chandraa Clinic, Alambagh, Lucknow",500,45 years,N/A,2025-05-29 04:47:22
lucknow,Dr. M. U. Hasan,"Tender Touch Clinic, Vikas Nagar, Lucknow",300,24 years,N/A,2025-05-29 04:47:22
lucknow,Dr. Sushama Nishant Upadhyay,"Kilkari Clinic, Indira Nagar, Lucknow",500,18 years,N/A,2025-05-29 04:47:22
lucknow,Dr. Mohammad Rehan,"Childrens Clinic, Vikas Nagar, Lucknow",200,27 years,N/A,2025-05-29 04:47:22
lucknow,Dr. A.K. Verma,"Srishti Newborn Care Centre, Indira Nagar, Lucknow",300,31 years,N/A,2025-05-29 04:47:23
lucknow,Dr. Jasminder Monga,"Monga Joint Replacement  Trauma Centre, Singar Nagar, Lucknow",300,27 years,N/A,2025-05-29 04:47:23
lucknow,Dr. Saima F. Khan,"Medanta, Vrindavan yojana, Lucknow",600,15 years,N/A,2025-05-29 04:47:23
lucknow,Dr. Abhishek Mishra,"Child Care Clinic, Jankipuram Extension, Lucknow",200,20 years,N/A,2025-05-29 04:47:23
lucknow,Dr. T.R. Yadav,"Global Child Care Centre, Aliganj, Lucknow",500,20 years,N/A,2025-05-29 04:47:23
lucknow,Dr. Rahul Dixit,"Charak Hospital, Dubagga, Lucknow",500,7 years,N/A,2025-05-29 04:47:23
lucknow,Dr. Sanjay Rohatgi,"Rohatgis Child Care Clinic, Mahanagar, Lucknow",400,41 years,N/A,2025-05-29 04:47:23
lucknow,Dr. Maroof Jilani Khan,"Jilani Clinic, Chowk, Lucknow",300,20 years,N/A,2025-05-29 04:47:23
lucknow,Dr. Ahsan Azaz,"Child Health Centre, Khadra, Lucknow",200,19 years,N/A,2025-05-29 04:47:23
lucknow,Dr. Narendra Rai,"Child Care, Gomtinagar, Lucknow",500,12 years,N/A,2025-05-29 04:47:23
lucknow,Dr. Saleem Lawrence,"Dr Saleem Lawrences Pediatric Clinic, Gomtinagar, Lucknow",300,26 years,N/A,2025-05-29 04:47:23
lucknow,Dr. Anil Kumar,"Anil Kumar Clinic, Aliganj, Lucknow",200,50 years,N/A,2025-05-29 04:48:00
lucknow,Dr. Niranjan Kumar Singh,"Vinayak Child Care, Jankipuram, Lucknow",300,20 years,N/A,2025-05-29 04:48:00
lucknow,Dr. Deep Varma,"Varma Clinic, Indira Nagar, Lucknow",400,52 years,N/A,2025-05-29 04:48:00
lucknow,Dr. Nyay Bhai Gupta,"Shourya Polyclinic And Vaccination Centre, Indira Nagar, Lucknow",500,17 years,N/A,2025-05-29 04:48:00
lucknow,Dr. Neeta Bhargava,"Dr Neeta Bhargav, Aishbagh, Lucknow",200,31 years,N/A,2025-05-29 04:48:01
lucknow,Dr. Vinay Kr. Gupta,"Babies Clinic, Lucknow, Lucknow",200,18 years,N/A,2025-05-29 04:48:01
lucknow,Dr. S K Chauhan,"Sakshi Clinic, L D A Colony, Lucknow",300,22 years,N/A,2025-05-29 04:48:01
lucknow,Dr. Rita Bagchi,"Shishu Mangal Bal Chikitsalya, Indira Nagar, Lucknow",350,41 years,N/A,2025-05-29 04:48:01
lucknow,Dr. Pranjali Saxena,"Healthy Steps, Gomtinagar Vistar, Lucknow",600,16 years,N/A,2025-05-29 04:48:01
lucknow,Dr. Ravi Bigghe,"Ravi Clinic, Lucknow Chowk, Lucknow",300,39 years,N/A,2025-05-29 04:48:01
lucknow,Dr. Md. Islam,"Nisha Clinic, Chowk, Lucknow",500,22 years,N/A,2025-05-29 04:48:01
ludhiana,Dr. Nitin Gupta,"Cloudnine Hospital, Mahaveer Nagar, Ludhiana",700,14 years,N/A,2025-05-29 04:48:42
ludhiana,Dr. Gurmeet Kaur,"Cloudnine Hospital, Mahaveer Nagar, Ludhiana",700,37 years,N/A,2025-05-29 04:48:42
ludhiana,Dr. Gaurav Mittal,"Mittal Dental and Children Multispeciality Clinic, New Hargobind Nagar, Ludhiana",500,25 years,N/A,2025-05-29 04:48:42
ludhiana,Dr. Rajiv Verma,"Well Baby Clinic, Pakhowal Road, Ludhiana",500,30 years,N/A,2025-05-29 04:48:42
ludhiana,Dr. Nupur Goel,"Cloudnine Hospital, Mahaveer Nagar, Ludhiana",700,8 years,N/A,2025-05-29 04:48:42
ludhiana,Dr. Sukhpreet Kaur,"Cloudnine Hospital, Mahaveer Nagar, Ludhiana",700,9 years,N/A,2025-05-29 04:48:42
ludhiana,Dr. Devendra Singh Batth,"Sehat Hospital, Urban Estate Phase 1, Ludhiana",350,34 years,N/A,2025-05-29 04:48:42
ludhiana,Dr. Uppal Saurabh,"Deep Children Hospital, Model Town, Ludhiana",500,16 years,N/A,2025-05-29 04:48:42
ludhiana,Dr. Narinder Toor,"Toor Hospital, Haibowal Kalan, Ludhiana",550,32 years,N/A,2025-05-29 04:48:43
ludhiana,Dr. Puneesh Saggar,"Saggar Newborn and Child Care Centre, SBI Civil Lines, Ludhiana",200,17 years,N/A,2025-05-29 04:48:43
ludhiana,Dr. R C Bhatia,"Dr RC Bhatia Clinic, SBI Civil Lines, Ludhiana",200,45 years,N/A,2025-05-29 04:49:19
ludhiana,Dr. Swarn Jeet S.Luthra,"Dr. S.J.S Luthuras Clinic, BRS Nagar, Ludhiana",200,53 years,N/A,2025-05-29 04:49:19
ludhiana,Dr. Ashish Wadhwa,"Amrit Nursing Home And General Hospital, Ludhiana, Ludhiana",400,38 years,N/A,2025-05-29 04:49:19
ludhiana,Dr. Vishal Gupta,"The Gargs Children Clinic, New Janta Nagar, Ludhiana",200,15 years,N/A,2025-05-29 04:49:19
ludhiana,Dr. G.P Singh,"Dr. G.P Singhs Clinic, Sarabha Nagar, Ludhiana",300,38 years,N/A,2025-05-29 04:49:19
